{
  "$schema": "https://raw.githubusercontent.com/Slicer/Slicer/main/Schemas/slicer-extension-catalog-item-schema-v1.0.0.json#",
  "build_dependencies": ["SlicerIGT"],
  "build_subdirectory": "inner-build",
  "category": "Cardiac",
  "scmrevision": "master",
  "scmurl": "https://github.com/SlicerHeart/SlicerHeart.git"
}
