{
  "$schema": "https://raw.githubusercontent.com/Slicer/Slicer/main/Schemas/slicer-extension-catalog-item-schema-v1.0.0.json#",
  "build_dependencies": ["MeshToLabelMap"],
  "build_subdirectory": "SPHARM-PDM-build",
  "category": "SPHARM",
  "scmrevision": "master",
  "scmurl": "https://github.com/NIRALUser/SPHARM-PDM.git"
}
