{
  "$schema": "https://raw.githubusercontent.com/Slicer/Slicer/main/Schemas/slicer-extension-catalog-item-schema-v1.0.0.json#",
  "build_dependencies": [],
  "build_subdirectory": ".",
  "category": "Quantification",
  "scmrevision": "master",
  "scmurl": "https://github.com/gattia/Slicer-T2mapping"
}
