{
  "$schema": "https://raw.githubusercontent.com/Slicer/Slicer/main/Schemas/slicer-extension-catalog-item-schema-v1.0.0.json#",
  "build_dependencies": ["SlicerProstate", "SlicerRT"],
  "build_subdirectory": ".",
  "category": "Registration",
  "scmrevision": "HEAD",
  "scmurl": "https://github.com/SlicerRt/SegmentRegistration.git"
}
