{
  "$schema": "https://raw.githubusercontent.com/Slicer/Slicer/main/Schemas/slicer-extension-catalog-item-schema-v1.0.0.json#",
  "build_dependencies": ["ModelToModelDistance"],
  "build_subdirectory": ".",
  "category": "Quantification",
  "scmrevision": "main",
  "scmurl": "https://github.com/naterex23/SlicerAblationPlanner"
}
