{
  "$schema": "https://raw.githubusercontent.com/Slicer/Slicer/main/Schemas/slicer-extension-catalog-item-schema-v1.0.0.json#",
  "build_dependencies": ["PyTorch"],
  "build_subdirectory": ".",
  "category": "Utilities",
  "scmrevision": "main",
  "scmurl": "https://github.com/fepegar/SlicerTorchIO.git"
}
