{
  "$schema": "https://raw.githubusercontent.com/Slicer/Slicer/main/Schemas/slicer-extension-catalog-item-schema-v1.0.0.json#",
  "build_dependencies": ["MarkupsToModel", "SlicerIGT", "SlicerRT"],
  "build_subdirectory": ".",
  "category": "IGT",
  "scmrevision": "master",
  "scmurl": "https://github.com/SlicerIGT/SlicerPathReconstruction.git"
}
