{
  "$schema": "https://raw.githubusercontent.com/Slicer/Slicer/main/Schemas/slicer-extension-catalog-item-schema-v1.0.0.json#",
  "build_dependencies": [],
  "build_subdirectory": ".",
  "category": "Filtering.Morphology",
  "scmrevision": "3f4146ddaa712c8f0a8418f49b2624a1dd6fd20a",
  "scmurl": "https://github.com/tokjun/ErodeDilateLabel.git"
}
