{
  "$schema": "https://raw.githubusercontent.com/Slicer/Slicer/main/Schemas/slicer-extension-catalog-item-schema-v1.0.0.json#",
  "build_dependencies": ["SlicerDevelopmentToolbox"],
  "build_subdirectory": ".",
  "category": "Utilities",
  "scmrevision": "master",
  "scmurl": "https://github.com/JoostJM/SlicerCaseIterator.git"
}
