{
  "$schema": "https://raw.githubusercontent.com/Slicer/Slicer/main/Schemas/slicer-extension-catalog-item-schema-v1.0.0.json#",
  "build_dependencies": [
    "SlicerDevelopmentToolbox",
    "QuantitativeReporting",
    "DICOMwebBrowser"
  ],
  "build_subdirectory": ".",
  "category": "Informatics",
  "scmrevision": "master",
  "scmurl": "https://github.com/SlicerProstate/mpReview.git"
}
