{
  "$schema": "https://raw.githubusercontent.com/Slicer/Slicer/main/Schemas/slicer-extension-catalog-item-schema-v1.0.0.json#",
  "build_dependencies": ["ModelToModelDistance"],
  "build_subdirectory": ".",
  "category": "Shape Analysis",
  "scmrevision": "master",
  "scmurl": "https://github.com/DCBIA-OrthoLab/MeshStatisticsExtension.git"
}
