{
  "$schema": "https://raw.githubusercontent.com/Slicer/Slicer/main/Schemas/slicer-extension-catalog-item-schema-v1.0.0.json#",
  "build_dependencies": ["SlicerRT"],
  "build_subdirectory": ".",
  "category": "Registration",
  "scmrevision": "master",
  "scmurl": "https://github.com/gsi-biomotion/Slicer-RegQA.git"
}
